{
  "$schema": "http://json-schema.org/draft-07/schema#",
  "title": "Atlas dungeon family",
  "description": "A shared template for eight member complexes. Holds the floor-graph shape, the hazard set, the room-count curve and the band function levelBand(index) = [base + step*index, base + step*index + span]. A member that overrides nothing is ~700 bytes; the family is why 24 of the 60 complexes cost almost no authoring.",
  "type": "object",
  "required": ["id", "title", "floors", "floorGraph", "hazards", "roomCountCurve", "levelBand", "entranceTypes"],
  "additionalProperties": false,
  "properties": {
    "id": { "type": "string", "pattern": "^family-[a-z0-9-]+$" },
    "title": { "type": "string", "minLength": 1 },
    "floors": { "type": "integer", "minimum": 1, "maximum": 12 },
    "floorGraph": { "type": "string", "enum": ["linear", "hub-and-spoke", "branching", "loop"] },
    "hazards": { "type": "array", "minItems": 2, "items": { "type": "string", "minLength": 1 } },
    "roomCountCurve": { "type": "array", "minItems": 1, "items": { "type": "integer", "minimum": 1 } },
    "levelBand": {
      "type": "object", "required": ["base", "step", "span"], "additionalProperties": false,
      "properties": { "base": { "type": "integer" }, "step": { "type": "integer" }, "span": { "type": "integer" } }
    },
    "entranceTypes": { "type": "array", "minItems": 1, "items": { "type": "string", "minLength": 1 } }
  }
}
